,id,text,timestamp,user,location
270,528325588973404160,"20,000 without power in northwest Indiana: Workers are trying to restore power to about 20,000 in northwest Indiana. http://dlvr.it/7NT7WP ",2014-10-31 23:20:10,Chicago_CP,Chicago
271,528296870708539392,"Thanks storm-induced power outage for interrupting my marathon of Buffy, couch potatoing, and bralessness.",2014-10-31 21:26:03,OhEmGlaser,Chicago
272,527891234749050881,"Plane crashes at Kansas airport, at least 4 dead: A small plane lost power after takeoff and crashed into a… http://dlvr.it/7MnwWX ",2014-10-30 18:34:12,Chicago_CP,Chicago
273,527875398575484929,"Plane crashes at Kansas airport, at least 2 dead: A small plane lost power after takeoff and crashed into a… http://dlvr.it/7MmT28 ",2014-10-30 17:31:17,Chicago_CP,Chicago
274,525992470589370370,ComEd explosion startles residents in Near North neighborhood: Several buildings downtown lost power early Saturday… http://dlvr.it/7JyND7 ,2014-10-25 12:49:12,Chicago_CP,Chicago
275,525984559452520448,ComEd vault explosion knows power out in downtown high rises: At least three underground Com-Ed vaults caught fire… http://dlvr.it/7Jxc2W ,2014-10-25 12:17:45,Chicago_CP,Chicago
276,525924255352254465,explosion out of the sewers in 4 different locations in Gold Coast. An explosion took place right outside my building and the power is out,2014-10-25 08:18:08,quartzbones,Chicago
277,523166297782099968,Nothing like dealing with a nationwide credit card outage on a Friday at lunch time to get the adrenaline pumping. #ComingDown,2014-10-17 17:39:00,cgumprecht,Chicago
278,521906439837999104,"@ComEd power is out in Bucktown, everything northwest of Western & Bloomingdale. @DNAinfoCHI @WickerParkBuck",2014-10-14 06:12:46,Adam_Ruder,Chicago
279,521729842119970816,"Enjoying my monthly scheduled internet outage. Thanks for your consistency, @comcast!",2014-10-13 18:31:02,ericreda,Chicago
280,521683789438005248,Power is out at work. Too early for this. #SOS #sendcoffee #andmaybesomewaffles,2014-10-13 15:28:02,laurenegaard,Chicago
281,519483702930591745,Power outage around my house so I just had to shower by candle light. #thestruggleisreal,2014-10-07 13:45:40,JenniferSoch,Chicago
282,519256696279941120,"Delays at O'Hare, Midway after Indianapolis FAA outage: Airline delays were increasing during the Monday evening… http://dlvr.it/772fyV ",2014-10-06 22:43:38,Chicago_CP,Chicago
283,519248776217640960,"FAA: O’Hare, Midway experiencing ground delays due to equipment outage: Flights coming in to O’Hare and Midway… http://dlvr.it/7725sm ",2014-10-06 22:12:10,Chicago_CP,Chicago
284,518152931271802881,Power out on metra train.  I held door open for 5 straight people.  Old man and woman each say thank you.  3 younger people walk right past,2014-10-03 21:37:40,DouglasJPump,Chicago
285,517920877598756864,Power outage in Rogers Park. I am in the dark.,2014-10-03 06:15:34,DavidFell,Chicago
286,517816353492041728,"Yup I'm on the train outside the station. ""@sayahillman: take red line if you can, brown line power out Belmont to Sedgwick #cta""",2014-10-02 23:20:13,jevnin,Chicago
287,517815945595990016,"take red line if you can, brown line power out Belmont to Sedgwick #cta",2014-10-02 23:18:36,sayahillman,Chicago
288,517813723897929728,Trapped in a train with the power out. Probably going to get #Ebola,2014-10-02 23:09:46,fatangelbaby,Chicago
289,517801844220116992,Ebola comin to wipe you out “@NoBeeetch: Power out.. Storm coming.. Phone on 4% .. If this my last tweet... Fuck y'all...... Except chicken”,2014-10-02 22:22:34,chiefpoloo,Chicago
290,517655107941695488,"@RCNconnects is there an outage in Chicago? Online light on my modem went out 15 min ago, stayed out after restart. pic.twitter.com/m8N5JD5WFX",2014-10-02 12:39:29,arsduo,Chicago
291,516738216268165121,@TotusPower bringing power to classrooms without power using lithium batteries from cars in partnership with @bmw #bethechange <3 BMW!,2014-09-29 23:56:05,jasonhenrichs,Chicago
292,514441637896798209,Simeon power out ,2014-09-23 15:50:19,El_LeoDeFreako,Chicago
293,513044854616907776,"@ComEd is there an outage in 60614, specifically on Geneva terrace? Any eta is so? Thx",2014-09-19 19:19:59,kferguson23,Chicago
294,512941972873437184,For with God nothing is ever impossible and no word from God shall be without power or impossible of… http://instagram.com/p/tII3ZBIDlj/ ,2014-09-19 12:31:10,THEREALDAVEJEFF,Chicago
295,512054149719261185,Power outage :(,2014-09-17 01:43:17,MasabuAida,Chicago
296,511593764847353856,lol power out ,2014-09-15 19:13:53,alexbrownlol,Chicago
297,511268865146253312,Power outage again! My building sucks. #homeownership here I come!!!!,2014-09-14 21:42:51,apatte21,Chicago
298,511155286934323200,"Remember the time theflaminglips lost power at #riotfest? But then power came back, and the proceeded… http://instagram.com/p/s7cYIDlTWe/ ",2014-09-14 14:11:31,_____Gday,Chicago
299,510998808353071104,“@heyvandy: The flaming lips killing it. Even with a power-outage setback. #Riotfest pic.twitter.com/5WdXEExZEE” @Michaelplease,2014-09-14 03:49:44,GrumpyDadBryan,Chicago
300,510776710589972480,"2 Injured In Small Plane Crash: Two people are hospitalized, and many more without power, after a small plane... http://dlvr.it/6v84Sr ",2014-09-13 13:07:12,Chicago_CP,Chicago
301,510534637949820928,That power outage saved me lowki,2014-09-12 21:05:17,Zays_Veggies,Chicago
302,509718998385426432,fuckk!!! my power is out!!!,2014-09-10 15:04:13,ashleyyioscoo,Chicago
303,509704532625207297,Power is out.. Cool,2014-09-10 14:06:45,its_tiff_doe,Chicago
304,509146672677797888,"Hey @ComEd, power's out at Racine and School. HELP.",2014-09-09 01:10:00,julialitz,Chicago
305,509143906433650688,A transformer exploded in Wrigleyville and the whole block's power is out. Chill. Where's Michael Bay when you need him?,2014-09-09 00:59:01,honestly_probz,Chicago
306,509091680788942848,"@sprintcare data outage is. NOT the problem, it is an issue with plan switchover. Seriously.  Case number SD2760497.  Feel free, look it up",2014-09-08 21:31:29,SST3D,Chicago
307,508810607240708097,“@ESPNFantasy: We are aware of the current fantasy football outage and are working to resolve these issues” <<< no shit,2014-09-08 02:54:36,Dan_Glorious,Chicago
308,508783952614924288,I want the 2 minutes back I just spent watching some little robot child barking electricity out of his mouth turning on appliances for GE...,2014-09-08 01:08:41,thekevincochran,Chicago
309,508475088090329088,"Even a power outage can't stop this love!!
#andrewandjax @ Westmoreland Golf Course http://instagram.com/p/soZkD6P9j0/ ",2014-09-07 04:41:22,AmyEHartwick,Chicago
310,508309856051163137,"Storms knock out power to 174,000, more than 100,000 restored: About 50,000 ComEd customers were without power... http://dlvr.it/6qmhxH ",2014-09-06 17:44:48,Chicago_CP,Chicago
311,508148591270305793,Looks like there is some power out on Halsted. Looks darker than usual. @BoystownTweets #Lakeview,2014-09-06 07:03:59,ColinShively,Chicago
312,508099197870960640,"Severe Storms Leave Thousands Without Power: More than 100,000 residents in the Chicago area were in the dark... http://dlvr.it/6qVwrl ",2014-09-06 03:47:43,Chicago_CP,Chicago
313,508095248380461058,@ComEd been about 4 hours without power in south Evanston. Any time frame for it to be restored?,2014-09-06 03:32:01,AaronSchapiro,Chicago
314,508068186735255552,"Lost power, candles and the sound of rain",2014-09-06 01:44:29,rcnauert58,Chicago
315,508028358412996608,"Tens of thousands #without #power in Glenview, Northbrook and Park Ridge.",2014-09-05 23:06:14,PencoElectric,Chicago
316,508005840688021504,Power's out in Evanston. Brilliant.,2014-09-05 21:36:45,Noam25,Chicago
317,507994158359793664,"Yet nothing here. “@nbcchicago: ComEd reports 108,000 #Chicago-area customers without power in wake of storm http://nbcchi.com/HqRbciK ”",2014-09-05 20:50:20,CourtTerleckiTV,Chicago
318,507730398206771200,@chicagotribune power outage 20mins ago from at least Clark/Surf-Sheridan/Surf.,2014-09-05 03:22:14,AndyAmbrosius,Chicago
319,507725950008983552,My entire courtyard building has lost power for no reason #blackout #wtf #iwasreadingdamnit,2014-09-05 03:04:34,SkeminNiemann,Chicago
320,507723267654680576,"“@AmerenCorp: Power out? Please notify us!"" I thought it was, but then I flicked a switch and the lights came on.",2014-09-05 02:53:54,nerfect,Chicago
321,507575197352726528,We lost power in our kitchen and bathroom.. What,2014-09-04 17:05:32,Karlymellis,Chicago
322,507265091335499776,That 20 minute Facebook outage could have cost the company around a half million dollars - http://tcrn.ch/Z7rEz5 ,2014-09-03 20:33:16,NemiahFelipe3,Chicago
323,506555950137081857,@ComEd reported outage Sat. 3 crews failed to fix.  Made appt for 9 am today -- no show. Now they say call back only if nobody shows by 6.,2014-09-01 21:35:24,MichWolv,Chicago
324,505744317621628928,The fucks up with this power outage,2014-08-30 15:50:16,bret_28,Chicago
325,504427471736168448,The power is out in my house.. Except for one light in my room #paranormalactivity,2014-08-27 00:37:35,_shan_h,Chicago
326,504133415055405056,Power out. If the purge starts tonight I sure picked a bad time to sprain my ankle.,2014-08-26 05:09:07,gubatuba,Chicago
327,504021594571018241,"@carolinefm yeah, everyone's fine, the tree fell in front of the house next door! We just lost power.",2014-08-25 21:44:47,IJamEcono,Chicago
328,503984673962217473,Mari power out,2014-08-25 19:18:04,Im_Billybob,Chicago
329,503962519359455232,Power out!  Mother Nature & God I have work to do,2014-08-25 17:50:02,Suvondal,Chicago
330,503960612767297537,My #EverySimpsonsEver marathon has been rudely interrupted by a power outage.  Worst electricity ever.,2014-08-25 17:42:27,atodd21,Chicago
331,503952276508381186,Damn thunder knock the power out ,2014-08-25 17:09:20,jbrown3690,Chicago
332,503748335153737729,"According to ComEd, 501-1,000 ppl in my area are impacted by an outage w/ an unknown cause. Rejoicing that ours stayed on #cantlivewithoutac",2014-08-25 03:38:56,arpodgorny,Chicago
333,503376462188007425,Going on 8 hours without power. Good job @ComEd,2014-08-24 03:01:15,Bob_Reinard,Chicago
334,503308896505974784,Power is out and dad needs a beer. - Drinking a Summer Love by @VictoryBeer @ Whole Foods  — http://untpd.it/s/c109573637 ,2014-08-23 22:32:46,aneeltrivedi,Chicago
335,503271115368960000,"Power out! (@ Carter Temple C.M.E. Church in Chicago, IL) https://www.swarmapp.com/jsymone/checkin/53f8f35e498e318f87c7fcbd?s=z3fWPZF9ZJGqb-oKtI4ZFiqsn3s&ref=tw …",2014-08-23 20:02:38,JSymone,Chicago
336,503235046984400896,"regram @feedthesol
Bad news: we're closed b/c of another neighborhood power outage. GOOD NEWS: we're… http://instagram.com/p/sDKq0AvKJc/ ",2014-08-23 17:39:19,BaristaBatgirl,Chicago
337,503007137308893184,sitting outside keeping cool sippin on some kool aid jammers with Lo since our power is out,2014-08-23 02:33:41,nappy_ish,Chicago
338,502894230143262721,Our power out like a bitch.. I had to come to my car to charge my phone,2014-08-22 19:05:02,cheese_nae,Chicago
339,502610412865863681,Another @comcast internet outage near Chicago. The second one is three weeks. Luckily it will be back by 10:17 pm...,2014-08-22 00:17:15,dldougherty,Chicago
340,502584735814934528,People in west hall are complaining about not having AC now that the power is out LOL. There's never AC in south shake it off ya wimps,2014-08-21 22:35:13,grimydiva,Chicago
341,502581783104593921,The power is out at Trinity and my phone is gonna die ,2014-08-21 22:23:29,grimydiva,Chicago
342,502573026756796416,I go to Rosie's and the power is out just my luck,2014-08-21 21:48:41,Gundo17,Chicago
343,502564942583975936,"wtf I fell asleep in my living room and woke up to thunder, my power out, all the blinds shut, and nobody home",2014-08-21 21:16:34,jilliannsaless,Chicago
344,502295318537715713,"@sprintcare what's going on with my LTE? I'm located at Central Park & Fullerton zip code: 60647... if you say another outage, I'll flip.",2014-08-21 03:25:10,TheCatalystKay,Chicago
345,502232743900876800,#Outage in #chicago #comed pls do ur work,2014-08-20 23:16:31,iamkerlitaps,Chicago
346,502168267776352256,Power outage in the middle of a nice day... that's odd... and very unhelpful for my productivity. #Chicago #fb,2014-08-20 19:00:19,mbsargent,Chicago
347,501858385437155328,.@sarahkendzior Juat what #Ferguson needs--hot muggy weather with a side of power outage.,2014-08-19 22:28:57,alan_uplc,Chicago
348,501754454019170304,Power is out. Pooping by candlelight. How romantic :-/,2014-08-19 15:35:58,rmiran2,Chicago
349,501410287824949248,"sooo... my power is out. 

awesome.",2014-08-18 16:48:23,meeeeee_shell,Chicago
350,501393903304835072,Something just exploded and was followed by screaming. Now our power is out and all the kids in the park are gone. Weird.,2014-08-18 15:43:16,daniwhatwhat,Chicago
351,500667208989552640,power out,2014-08-16 15:35:39,TheOneNOnlyG,Chicago
352,500385647879016448,"@candlesayshi @smokes70 @RCNconnects I'm in Lakeview East,  there's an outage in my area. Internet down for past hour, and just lost TV",2014-08-15 20:56:49,rhrad,Chicago
353,499984519298949120,@TheIrishFish 1st subway ride...lost power. Awesome,2014-08-14 18:22:53,bmac222,Chicago
354,499444900057067520,"@ComcastCares Is there an Internet outage in 60657? My WiFi says very slow internet connection 
#mobile_CareXV",2014-08-13 06:38:38,ColinShively,Chicago
355,498973381983608832,Sitting out at the park during a power outage @ Kenwood Park http://instagram.com/p/rk4sBby5DF/ ,2014-08-11 23:24:59,mokuton_sativa,Chicago
356,498473933772181505,Will be switching providers if this internet outage isn't sorted out soon. #Comcast you're not the only game in town.,2014-08-10 14:20:21,NigelPatterson,Chicago
357,498285240004407296,I better get a discount on my bill @RCNconnects An entire day outage for internet and cable is ridiculous.,2014-08-10 01:50:33,shylyassertive,Chicago
358,498244193576570881,"Ugh, another full day with no @comcast cable service in Uptown Chicago, and sadly still no indication of when this outage will be resolved!",2014-08-09 23:07:27,samsoir,Chicago
359,498196177360543744,Switched from Comcast to @RCNConnects with hopes of improved service. Now have internet outage on top of broken cable box. Not a good start,2014-08-09 19:56:39,GADaly,Chicago
360,498155999862472704,@RCNconnects are you showing internet outage in the 60657 area?,2014-08-09 17:17:00,visualredesign,Chicago
361,497540370423885824,Seriously @comcast an internet outage in 60613?,2014-08-08 00:30:42,RookeyOfTheYear,Chicago
362,497524533734440961,Power's out on my block? No problem! Beach day  @ Foster Avenue Beach http://instagram.com/p/ral1A_D6Jz/ ,2014-08-07 23:27:47,bsalazar215,Chicago
363,497494159469858816,Power out on Kenmore and Berwyn in Chicago #poweroutage #EdgewaterLive @EdgevilleBUZZ,2014-08-07 21:27:05,miguelmoreno,Chicago
364,496732984691945472,"Get to the gym, and they talking about the power out. T f that got to do with me?",2014-08-05 19:02:27,CovergirlPhy,Chicago
365,496524093509107712,This whole side of the neighborhoods power is out but off course every damn light in Urban Outfitters… http://instagram.com/p/rTe4YABPS0/ ,2014-08-05 05:12:23,VOArockers,Chicago
366,496521010569814016,"Following our wicker park power outage Abby yells: ""guys! My ice cream is going to melt, we have to hurry up and eat it!"" #spookydookie",2014-08-05 05:00:08,PomOotOOT,Chicago
367,496487495383527425,Power is out and phone is on 10 % ,2014-08-05 02:46:57,bgirlmystify,Chicago
368,495034071052197888,"Recording podcast tomorrow, assuming Comcast outage ends.",2014-08-01 02:31:34,brianbolek,Chicago
369,494991889033359360,Comcast outage in wicker/humboldt park :(,2014-07-31 23:43:57,creardon,Chicago
370,494986053926023168,@sprintcare There is ALWAYS some outage. Always some problem! Always an excuse! There is never just straight up service! Ridiculous!,2014-07-31 23:20:46,ChristinaAMN,Chicago
371,494974618269417473,So frustrated with comcast having issues in Chicago. Said it'll be down til 8:30pm. 5 hr outage?! Ridiculous! #nointernet #comcastdown,2014-07-31 22:35:19,cuddlycrew,Chicago
372,494303439959371777,My mom just texted me that our power is out at home. Prolly shouldn't leave this game yet.,2014-07-30 02:08:18,katiekelley1991,Chicago
373,493604639959683072,Usually own outage him but he really but air in my sails today...forget jewels n money..can your man ENCOURAGE you?! That's a treasure,2014-07-28 03:51:31,OfficiallyNae,Chicago
374,493567444972482562,Of course the power is out again,2014-07-28 01:23:43,ND_Sox13,Chicago
375,492846307292508161,@WBBMNewsradio Covering the power outage on the main stage at the Whiting #perogifest.,2014-07-26 01:38:10,mikejmoe,Chicago
376,492834076370292736,@junkfoodeaton I think I was the only person that used this flashlight as a kid during a power outage,2014-07-26 00:49:34,SierrasJoy,Chicago
377,492832207640494080,@tapiriik no files copied for me since weds pm.. Another outage ?  They don't show up on /activities .,2014-07-26 00:42:09,erik_d,Chicago
378,492749705831387136,Power outage at work = drinks and lunch at Whole Foods. Have I mentioned how much I love my new job?… http://instagram.com/p/q4qfMtj4oD/ ,2014-07-25 19:14:19,gelbofthrones,Chicago
379,492726063198244864,Call #ChairmanBob!! The power's out at the #Mariano'sFreshMarket in Bucktown!pic.twitter.com/lIMjCAgfl6,2014-07-25 17:40:22,jenniferschwarz,Chicago
380,492562106986659840,Phone was dead most of the day and came home to a power outage #sweet,2014-07-25 06:48:52,ericjunior22,Chicago
381,492105472510791680,@ChuckWendig Once weathered an outage caused by an eagle dropping a deer head on a power line. 100% for-real no-troll-zone. #AlaskaStories,2014-07-24 00:34:22,missroserose,Chicago
382,492087000867295233,"@packer_hawk Oddly enough, I never lost power during that mess. *However*, fun story about that night...",2014-07-23 23:20:58,hawkeyeguy85,Chicago
383,491780855027597312,@Bugzbni Horrible. Claim it was power outage. No proof or just doesn't care! :(,2014-07-23 03:04:27,barbiesinger,Chicago
384,491060182651125762,A man without friends is a man without power...,2014-07-21 03:20:45,Llewelark,Chicago
385,490883025954025474,Power outage at Six Flags Great America in Gurnee strands riders: Power was restored at the Six Flags Great... http://dlvr.it/6NBPLj ,2014-07-20 15:36:48,Chicago_CP,Chicago
386,490851398653714432,Power outage hits Six Flags Great America: Things are expected to be back to normal today at Six Flags Great... http://dlvr.it/6N8QhL ,2014-07-20 13:31:07,Chicago_CP,Chicago
387,489758476097187841,"#BOY_A_MY Power outage in Wesmont, IL: At exactly 6:50 a.m. Power interrupted the offices of... http://cnn.it/1jBg7Rt  [ #Luiis_3x ] ",2014-07-17 13:08:14,OfficialOzuna,Chicago
388,489758450474160131,"(@Team_iUnGalan_) Power outage in Wesmont, IL: At exactly 6:50 a.m. Power interrupted the off... http://cnn.it/1jBg7Rt  (Via @Yeremiix3)",2014-07-17 13:08:08,OfficialOzuna,Chicago
389,489758425232838656,"(@Team_iUnGalan_) Power outage in Wesmont, IL: At exactly 6:50 a.m. Power interrupted the off... http://cnn.it/1jBg7Rt  (Via @Yeremiix3)",2014-07-17 13:08:02,DauriPostale,Chicago
390,489758349164949507,"#AntonSolamente Power outage in Wesmont, IL: At exactly 6:50 a.m. Power interrupted the offices of... http://cnn.it/1jBg7Rt  #Lafalacia_",2014-07-17 13:07:44,Dime_placido,Chicago
391,489253896494149633,My blue-ray player and garage door motor are refusing to work after that power outage/surge. Thanks!! @ComEd,2014-07-16 03:43:13,Caitalinaa,Chicago
392,489212953132953600,Eating dessert by #candlelight because the power is out. #Forced #QualityTime pic.twitter.com/6ph6fZT63e,2014-07-16 01:00:31,KarinHuenink,Chicago
393,489073422345846784,@ComEd how do I report the outage?,2014-07-15 15:46:05,BahjaNorwood94,Chicago
394,488179177296654337,Loud boom sound followed by power outage,2014-07-13 04:32:40,LawrenceInTune,Chicago
395,488150024447340544,What I wouldn't do for a good power outage right about now,2014-07-13 02:36:49,Paul_Dabrowski,Chicago
396,487937288501202944,"I'm ""working"" by sitting on the couch in the dark cus the power is out yay ",2014-07-12 12:31:29,zubtoohood,Chicago
397,487782961748930561,Well.... The venue just lost power while @SayAnythingMuz were mid-song #Chicago #riotfest #wtfstorm,2014-07-12 02:18:15,Meowwrita,Chicago
398,487756320356188160,"Sooooo about this power outage tho! Shoot, I fed him... Thx man! @ The Official Progressive Baptist… http://instagram.com/p/qVLwl6tHuz/ ",2014-07-12 00:32:23,mstaniaj,Chicago
399,486700887406940160,"Home:
Where the wifi is always functioning unless there's a power outage.",2014-07-09 02:38:28,maximilianos22,Chicago
400,486697470450089984,Power's out in Park Ridge...hope all the groceries I just bought don't spoil...,2014-07-09 02:24:54,vandirty29,Chicago
401,486613850717175808,Power outage in Belo Horizonte now!  They heard it worked at the Super Bowl I guess...,2014-07-08 20:52:37,KirkCHI,Chicago
402,486613211240611840,Brazil's first move in the second half is for sure to cut the lights. Nothing like a power outage during the game in time for a turnaround.,2014-07-08 20:50:05,PhillyBlunttt,Chicago
403,486380151739924480,.@comed power outage in wicker park on 1800 w block of evergreen.,2014-07-08 05:23:59,aMustReid,Chicago
404,485294707119886337,"Power outage. I was too tired to put laundry away anyway. So sleeping bag on floor, flame-less candle, and a good book = apartment camping.",2014-07-05 05:30:49,KaRashDi,Chicago
405,485240192815489024,Some Park Forest residents still without power on 4th: Monday night's storms knocked out power to as many as... http://dlvr.it/6D3gHX ,2014-07-05 01:54:11,Chicago_CP,Chicago
406,485127864459603968,#Google down as search services suffer intermittent outage http://tinyurl.com/kdgd8ok ,2014-07-04 18:27:50,NathashaParker,Chicago
407,484906485013438465,"Nearly 10,000 Without Power After Monday’s Severe Storms: (CBS) – Nearly 10,000 customers remain without power... http://dlvr.it/6CWhxG ",2014-07-04 03:48:09,Chicago_CP,Chicago
408,484826868298686464,Many still without power days after storms: Crews are still working restore power for some residents after Monday... http://dlvr.it/6CQtkz ,2014-07-03 22:31:47,Chicago_CP,Chicago
409,484826787457683458,Thousands without power in the Chicagoland area for over three days.  Get peace of mind with a #Generac #generator.,2014-07-03 22:31:28,PencoElectric,Chicago
410,484750735662276608,Soooo.. Why is my power out,2014-07-03 17:29:16,McClain21,Chicago
411,484746156950319106,cool we just lost power and it's not even storming....,2014-07-03 17:11:04,casshole_mf,Chicago
412,484741343428636672,AT&T confirms outage in South suburbs: Some south suburban Chicago AT&T customers are experiencing... http://dlvr.it/6CK6m3 ,2014-07-03 16:51:56,Chicago_CP,Chicago
413,484438063981268992,@courtcosgrove_ I never lost power,2014-07-02 20:46:49,Alexthesav_,Chicago
414,484405284333690880,So legit I just lost power?,2014-07-02 18:36:34,Softballlove04,Chicago
415,484394041572745216,@TrueBoyRj I Was Supposed To Get My Hair Done But The Power Out At The Hair Shop ,2014-07-02 17:51:53,brialesiaa_,Chicago
416,484288175209058305,Of course the power is out at work but we have to stay here ,2014-07-02 10:51:13,houbolt_meghan,Chicago
417,484145374089969664,I feel really bad for people without power,2014-07-02 01:23:46,Alexthesav_,Chicago
418,484134546842341376,@exavierpope Had a power outage in my office bldg. Had to follow score on my phone.,2014-07-02 00:40:45,DarleneDeJohnet,Chicago
419,484101463195791360,@WaddleandSilvy we had power outage in office bldg..had to turn tv off,2014-07-01 22:29:17,DarleneDeJohnet,Chicago
420,484093997213032448,hungry but nothing is open due to the power outage,2014-07-01 21:59:37,karolinakairyss,Chicago
421,484040195969261568,Huge outage with AT&T by my house. I JUST WANNA MAKE A CALL OR TEXT SOMEONE ,2014-07-01 18:25:50,colee_slaw,Chicago
422,484037505126125568,I would rather live in a third world country then Chicago without power,2014-07-01 18:15:08,elianderson_18,Chicago
423,484036638289305600,"@nairmak_gren oh yes, minus the power outage. :) My wife and I are from Chicago, so it's nice to visit. :)",2014-07-01 18:11:42,krolco,Chicago
424,484016455260708864,"If you are without power, please call 1-800-Edison-1.",2014-07-01 16:51:30,mattoshea19,Chicago
425,483988444008693760,@ComEd any outage updates in Woodlawn? Your site won't allow me to sign up for text updates and the map shows no progress/information.,2014-07-01 15:00:11,Jen_Ken,Chicago
426,483985706138603522,"@ComEd I see 'em working, TY. Glad weather is nice 4 them.  #chicago #poweroutage #WickerPark maybe up & running n time 4 #WorldCup #USMNT",2014-07-01 14:49:19,MommyAndTheCity,Chicago
427,483969956346724352,"20 seconds once signed in to see there's a @comcast outage, but with no text/phone alerts, I need internet to check pic.twitter.com/w1A5qYWPyJ",2014-07-01 13:46:43,n_t_grimm,Chicago
428,483954651356618752,Just woke up this morning and the power is out. Thank you Mother Nature.,2014-07-01 12:45:54,bronychefpro,Chicago
429,483953296420663296,"Yep, all night. Assume we won't be charged...Utilities report 538,929 customers without power in 5 Midwestern states http://www.breakingnews.com/t/SjL """,2014-07-01 12:40:31,WilliamDale_MD,Chicago
430,483947722928447488,This is a modem. This is your modem on @comcastcares with no solid lights - hour 20 of outage. cc @XFINITYpic.twitter.com/CpQ9KdWFp2,2014-07-01 12:18:23,Chicago_Todd,Chicago
431,483942576429363200,"In Morris, Hundreds of Trees Down, Hospital Without Power: Morris Fire Chief Tracey Steffes estimated Tuesday... http://dlvr.it/6B12BD ",2014-07-01 11:57:56,Chicago_CP,Chicago
