,id,text,timestamp,user,location
432,483939868267909121,"ComEd: 216,000 customers still without power after thunderstorms
 http://bit.ly/1lNvzJs ",2014-07-01 11:47:10,ChicagoBernie,Chicago
433,483939257048784898,@erinscafe @KidsDrDave Hour 19 for outage of @comcastcares. Rough going - we lost Sally and Fred to Facebook withdrawal. Not a pretty sight.,2014-07-01 11:44:44,Chicago_Todd,Chicago
434,483933788976582656,@ComEd texting your number says #s arent registered & can't download app - dying phones. Any update on our area? #chicagoridge #outage,2014-07-01 11:23:01,StephSewe,Chicago
435,483933386063364096,216K without power after storms rake Chicago area: A pair of severe thunderstorms rumbled through the Chicago... http://dlvr.it/69zmXr ,2014-07-01 11:21:24,Chicago_CP,Chicago
436,483909010219753472,I am grateful & thankful that my area DIDN'T have a power outage from last night's brutal thunderstorm. #AllSystemsAreGo,2014-07-01 09:44:33,premier1914,Chicago
437,483873805027139584,@Comed any update on the outage in #chicagoridge? Your automated system isn't helpful.  Flooding basement. No word on restoration times.,2014-07-01 07:24:39,StephSewe,Chicago
438,483842741223579648,They having sex while the power out and shit,2014-07-01 05:21:13,Cali__Macc,Chicago
439,483829124159393792,Is your power out let us know #NWBURBSstorm #ComEd,2014-07-01 04:27:06,t_robb1,Chicago
440,483828644079357952,@djergss hahaha love that movie.  Too bad my power is out. Lol,2014-07-01 04:25:12,Rich_Lamb23,Chicago
441,483820086395166720,It's crazy out here in Chicago storms got trees fallin n shit. Power out ,2014-07-01 03:51:12,Otf_Jada,Chicago
442,483819106999599104,@soniakorszlaa is your power out?,2014-07-01 03:47:18,biancagarrette,Chicago
443,483817663261466624,@Irann_15 @Jacckieeee people's power is out,2014-07-01 03:41:34,summer_geeee,Chicago
444,483817346230792192,Just sitting around without power listening to the #chicagoscanner on @kbenker's phone,2014-07-01 03:40:18,faintlyamused,Chicago
445,483816586424229888,“@J_BoogieFto: If Yo Power Out You A Bitch ”lmfao on4nem,2014-07-01 03:37:17,CampaignUnique_,Chicago
446,483816485685829632,So the power is out but the internet is still working? #notthatiamcomplaining #ChicagoWeather #thunderstorm #sittinginabathtub,2014-07-01 03:36:53,theHeatherAimee,Chicago
447,483815968376778752,You guys are talking about how storms are cuddle times but this storm isn't suppose to be cute. You can't watch movies without power,2014-07-01 03:34:50,TheEdgar12,Chicago
448,483815480721805312,Everyone talking bout they power out... let put my phone on the charger....,2014-07-01 03:32:54,danielle_allysa,Chicago
449,483813957338427392,Stuck in the basement hoping it don't flood w the power outage,2014-07-01 03:26:50,giovangeloh,Chicago
450,483810822376812544,I'm well prepared for a power outage with scented candles and about 14 pen lights.,2014-07-01 03:14:23,daniCheyenne,Chicago
451,483786565080997889,Good thing my dad whipped out his transistor radio in this power outage  @get_weild,2014-07-01 01:38:00,itswheelxx,Chicago
452,483785846814818304,@maggiehennigann is your power out!!??,2014-07-01 01:35:08,mari3ll3n,Chicago
453,483772641442938880,If this storm knocks the power out while I'm watching #Bachelorette I will not be a happy girl ,2014-07-01 00:42:40,jamieevans___,Chicago
454,483772306125520896,Y'all fuckin call this shit a derecho??? When I was in Ohio I was stuck in a power outage after a derecho w/ nothing but Jell-O shots to eat,2014-07-01 00:41:20,loosecannonCJ,Chicago
455,483770816065437696,So my power is out and my phone gonna die. Oh well,2014-07-01 00:35:25,CMB_PrettyHurts,Chicago
456,483750452157108224,Charging my phone and all other devices in case this storm wants to fuck up and take my power out smh.,2014-06-30 23:14:30,Obey_Enrique,Chicago
457,483553902625693696,I hope there's a power outage at work.,2014-06-30 10:13:29,_JuuuChainzz,Chicago
458,482329997797908481,"Power's out, home alone. Just gonna sit here and wait for the murderers.",2014-06-27 01:10:07,rileycoyote,Chicago
459,481969093562466304,"@sahadevsharma that said, he's probably right in that he can play the game regardless of a power outage",2014-06-26 01:16:01,mattdennewitz,Chicago
460,481875794751266817,835 people without power because a transformer poped out  and I'm one of them ,2014-06-25 19:05:16,AReyesNico,Chicago
461,481828930551574531,"@Ms5FDP power out on 3rd rail at lasalle, bussed at western, took green line to Clark/lake and walked. What a fiasco. Chris was mad lol",2014-06-25 15:59:03,mike__erickson,Chicago
462,481824569523576832,"Power outage on #blueLine, one reason why I prefer buses to trains. It breaks down, you get off and hop on thee next one. #ctachronicles ",2014-06-25 15:41:43,CTAChronicles,Chicago
463,481820211478147072,Power outage causes major delays on CTA Blue Line: A power outage on the CTA Blue Line's Forest Park branch was... http://dlvr.it/66f24V ,2014-06-25 15:24:24,Chicago_CP,Chicago
464,481820192532492289,Blue Line Trains Delayed Due To Power Outage: CHICAGO (CBS) – Blue Line trains were operating on a single track... http://dlvr.it/66f1wB ,2014-06-25 15:24:20,Chicago_CP,Chicago
465,481819791833841664,Stalled on the Blue Line due to “power outage”. The natives are getting restless.,2014-06-25 15:22:44,NtroP,Chicago
466,481815343652823042,Blue Line service downtown delayed by power outage near LaSalle: CTA Blue Line trains are experiencing major... http://dlvr.it/66dVDG ,2014-06-25 15:05:04,Chicago_CP,Chicago
467,481801378571247616,For anyone riding the CTA blue line. Theres a power outage on LaSalle so everything is fucked up. #CTA #chicago,2014-06-25 14:09:34,david_amoran,Chicago
468,481799019552047104,Power out since 1030pm last night - @ComEd cust sv spviser just now told me crew is en route - it's been out over 10hrs!!,2014-06-25 14:00:12,timothygannon,Chicago
469,481793782996692992,@CTAFails @oskah4 CTA probably diverted it to shuttle Blue Line pax caught in power outage. Not! #AllowExtraTravelTime,2014-06-25 13:39:23,ORDjanet,Chicago
470,481793421225373696,#CTA power outage from Grand to loop.  #publictransitrulez,2014-06-25 13:37:57,LylaCatellier,Chicago
471,481793203038060544,Power out again!!  What's up @comed ?,2014-06-25 13:37:05,timothygannon,Chicago
472,481792274498457601,@cta @CTAFails power outage on Blue line. CTA say #AllowExtraTravelTime or #WorkFromHome,2014-06-25 13:33:24,ORDjanet,Chicago
473,481790105556774912,"Were you without email yesterday, tips for the next (cuz it will happen again) Outlook outage http://www.inc.com/minda-zetlin/how-long-could-you-go-without-email.html?cid=sf01001 …",2014-06-25 13:24:47,LindsayHorwood,Chicago
474,481600121671778304,The storm knocked the power out. It's too hot for this.,2014-06-25 00:49:51,cywill33,Chicago
475,480541909463867392,"Sister lost power at her place, called me to ask to crash @ the condo. 2 problems not at home, and I have to work a quick shift tomorrow.",2014-06-22 02:44:53,Illinoisgirl,Chicago
476,480487836202721282,My WiFi just cut off guess the power out,2014-06-21 23:10:01,LeQuanTheDon,Chicago
477,480065489670909952,"Tryna lift and get some shots up, but the gym power is out ",2014-06-20 19:11:46,Monte5ive,Chicago
478,479560354716864512,“@CNBCWorld: Facebook is back up after suffering a brief outage http://cnb.cx/SVFv7G  $FB” #bigyawn,2014-06-19 09:44:33,jambrick,Chicago
479,479318074433478656,My power out and my phone bout to die ,2014-06-18 17:41:48,QuierraaB,Chicago
480,478935251465818112,Power out....  #WayToStartMyMorning,2014-06-17 16:20:36,CirocODrama80,Chicago
481,478877610525466624,Just lost power in the entire neighborhood. Maybe it's a sign I should take a nap instead of cleaning... #HOT,2014-06-17 12:31:34,LauraKBarajas,Chicago
482,478293662837665792,The power out....I think it's because somebody was shooting firecrackers at the wires ,2014-06-15 21:51:10,Lust_ForLife,Chicago
483,477134860797349888,"Well, that show had a little of everything.  A power outage, a perv call, and Rach yelling at me.  #tuneinnexttime",2014-06-12 17:06:30,bigpayoffradio,Chicago
484,477125426796830720,Power's out at Moody. I hope the automatic flush still works in the bathroom,2014-06-12 16:29:00,Robriv,Chicago
485,476539931435601920,So far so good The Spurs shooting lights out The only thing the Heat can hope for now is a Superbowl style power outage #MIAvsSA #NBAFinals,2014-06-11 01:42:28,ShaneKDickinson,Chicago
486,475713562136961024,"@LewisHamilton says he has ""lost power"" on his @MercedesAMGF1 silver arrow. Lost 2 seconds so far from @nico_rosberg",2014-06-08 18:58:46,JimRoseABC7,Chicago
487,475648053681336321,@ComEd there has been an outage in my building for hours but there is no status updates on the ComEd map on your website... What's going on?,2014-06-08 14:38:27,PeterVega,Chicago
488,475608650078113792,Anyone in south OP/north Berwyn have a power outage too?,2014-06-08 12:01:53,tnzrz,Chicago
489,475607174853312512,"@ComEd POWER OUTAGE - Wesley Ave, S of Roosevelt, east side of street, Berwyn",2014-06-08 11:56:01,tnzrz,Chicago
490,475449821197651969,Power outage in Pilsen,2014-06-08 01:30:45,imcoatcheckgirl,Chicago
491,474922612343054336,@RAMinNYC #poweroutage what's the #realstory,2014-06-06 14:35:49,mburrage61,Chicago
492,474711931086209024,The cta train I'm on just lost power and is stopped for an emergency reason  help,2014-06-06 00:38:38,xceece,Chicago
493,474369014991691776,the struggle is so real when you have to conserve your phone battery cus your power is out at home. ,2014-06-05 01:56:01,MfcA_,Chicago
494,473605985249267712,Power out on my block = happy people!!!!!!,2014-06-02 23:24:00,audreyanfield,Chicago
495,473569041655668736,"Wheaton Students Treated After Gas Odor, Power Outage: Students at a suburban Chicago middle school were treated... http://dlvr.it/5s9bf1 ",2014-06-02 20:57:12,Chicago_CP,Chicago
496,473564901131034624,"25 students hospitalized after gas odor, power outage at Wheaton School: Twenty-five children were taken to... http://dlvr.it/5s9Jwj ",2014-06-02 20:40:45,Chicago_CP,Chicago
497,473541109553983488,"25 Students At Wheaton School Hospitalized As A Precaution After Gas Leak, Power Outage: (CBS) — 25 students at a... http://dlvr.it/5s7lkT ",2014-06-02 19:06:13,Chicago_CP,Chicago
498,473214387868946433,The three armed inspections and the bus getting a flat tire at 3am in the DR make the CTA Blue Line outage seem like cake.,2014-06-01 21:27:56,GRaryRay,Chicago
499,472560301833871360,"For those without power in Muncie, the pacers are still losing. #update",2014-05-31 02:08:50,Mmo4,Chicago
500,471716027529572352,Power outage on blue line at Logan Square causing delays at Montrose. Delayed at Jefferson before. What's up @cta?,2014-05-28 18:13:59,lwhittet,Chicago
501,471462048589950977,I just pissed in the dark nanas power is out and shit ,2014-05-28 01:24:46,alyssareneejoan,Chicago
502,471331914507231232,so I guess after an extended payments platform outage @SimpleePAY  decided to change their model which sucks . gonna close that acct,2014-05-27 16:47:40,fuadar,Chicago
503,471127623046037504,Power outage on the SW side of @CityofEvanston...Oakton and Dodge completely dark and no traffic lights. #usecaution,2014-05-27 03:15:53,EsdaPup,Chicago
504,470223866288037889,"It's hilarious when you call Comcast about an internet outage and the recording says ""for further outage info go to http://comcast.com """,2014-05-24 15:24:40,themikenorton,Chicago
505,468132124562706432,@RCNconnects I'm supposed to hear from you today or tomorrow about a line call to resolve my Internet outage since Thursday. Can you confirm,2014-05-18 20:52:50,picholas_narker,Chicago
506,467316079300460544,@RCNconnects are you guys experiencing an outage... Or is it just me?,2014-05-16 14:50:10,TeairaBurge,Chicago
507,467062474072530944,I’m trying to figure out what Creative Cloud does? How does an outage affect you if you aren’t downloading the app? Does it do storage?,2014-05-15 22:02:26,rickysalsberry,Chicago
508,467050791732543488,@comcast 12 hour outage last night 3 disconnects when I tried to call and 4 loops through the IVR. Very bad service!!!,2014-05-15 21:16:00,jnhphoto,Chicago
509,466080283620438016,"Just watched the apartment complex in front of my window get struck by lightning, they lost power & I lost vision #sobright #soloud ",2014-05-13 04:59:33,colee_slaw,Chicago
510,466074182766178304,Power out in LaGrange I'm watching the freaking playoffs fml,2014-05-13 04:35:19,Soulvillainchic,Chicago
511,466074153531867137,"Power's out, guns* out!

*dicks",2014-05-13 04:35:12,piratetastic25,Chicago
512,465732721700925441,I'm so sorry to all you nuggets without power..,2014-05-12 05:58:28,ash_huth,Chicago
513,465726595278569473,@CLEAR - service outage and customer support is closed?,2014-05-12 05:34:07,rkoloms,Chicago
514,465695562168168448,"I hope your a.c. creates a power outage and your whole house melts! Leaving nothing behind but your dog, and your dog ends up missing",2014-05-12 03:30:48,Oooooo_Yea,Chicago
515,465639314072682496,@asmallorange I understand a power outage in Dallas took down my VPS server; any idea when it will be back online?,2014-05-11 23:47:18,jamesbregenzer,Chicago
516,465343036994891776,Power outage in #chicago hope @TaylorKinney111 comes to save me.  #,2014-05-11 04:10:00,Kellsdelaroc,Chicago
517,465207513147650048,Aftermath of Joey's 30th birthday bash at jimmyatthejames @jameshotels #Chicago #PowerOutage @ JIMMY… http://instagram.com/p/n09v37O8Du/ ,2014-05-10 19:11:28,jamondeaver,Chicago
518,464580384634970112,Perfect everyone in river Shannon is wearing shorts and a tshirt cause they all lost power as well. #firstworldproblems,2014-05-09 01:39:29,Beardown101,Chicago
519,464579699654815744,Wow I'm legit the only block in the neighborhood without power!!! What did I do god what did I do?,2014-05-09 01:36:46,Beardown101,Chicago
520,464554541896458240,"Power out at work, it feels like living in the Stone Age without electricity. This is a real ThrowBackThursday.
#throwbackthursday",2014-05-08 23:56:48,eggz7z,Chicago
521,464553093641015296,"Power outage in Berwyn, il? @CityofBerwyn @ComEd",2014-05-08 23:51:03,mike__erickson,Chicago
522,463788731875348480,Power outage in my hood until 6pm. #weird,2014-05-06 21:13:45,tap_lust,Chicago
523,463436616447447041,The @BrentOzarULTD training challenge is on. Team #1 is troubleshooting the first outage. @ Catalyst… http://instagram.com/p/noYb-qJE7x/ ,2014-05-05 21:54:34,BrentO,Chicago
524,463042690683129856,@JoshVernier so it is possible to hit HRs at the K...we just don't have the players. #poweroutage #sweep,2014-05-04 19:49:15,GreatKatzby03,Chicago
525,462746334760427520,You know it's a power outage when.. pic.twitter.com/DGWgNupefj,2014-05-04 00:11:38,zolhernandez,Chicago
526,462076868699492352,Thought there was traffic that caused @Shazam to go bye bye/outage but my wi-fi was down! #iHeartAriana #iHeartJLo,2014-05-02 03:51:25,BenT215,Chicago
527,461537645902843904,@LorenzoPCordova power outage! creeeepy ,2014-04-30 16:08:44,elliepritts,Chicago
528,461514347714334720,@cta @CTAFails power out on Brown Line between Sedgwick and Mart means I've been on the train for 30 min between Paulina and Belmont.,2014-04-30 14:36:09,doug_ruhl,Chicago
529,461294484723351552,"The power is out at the Logan Square L station. Not gonna lie, it's pretty damn creepy. 

#poweroutage… http://instagram.com/p/nZKTzaOXVt/ ",2014-04-30 00:02:30,adehogue,Chicago
530,461278557201649665,Power outage at #LoganSquare @cta stop. Not scary at all.,2014-04-29 22:59:12,markitphoto,Chicago
531,460122654117089281,Cable and internet are out so im playing solitaire with real cards. Kinda like using a candle when the power is out but not really,2014-04-26 18:26:04,HeyyyyyJoe,Chicago
532,459894063349497856,@RCNconnects had a known outage in my area in Chicago. Well this sucks.,2014-04-26 03:17:43,CraigularB,Chicago
533,458990208826884097,"Park Ridge pole crash causes power outage: More than 1,000 northwest suburban homes were without power early... http://dlvr.it/5T8ryf ",2014-04-23 15:26:08,Chicago_CP,Chicago
534,458781732914081792,"@ZooMaster76 Helps if the power is out at home, & you're killing time at the pub & the landlord has leftover Easter candy.",2014-04-23 01:37:43,brittyknows,Chicago
535,458687270581575680,Plans to work on D8 this afternoon stymied by @comcast outage - debating waiting this one out or finding a coffee shop.,2014-04-22 19:22:21,brantwynn,Chicago
536,458598924228362240,@Vocalocity outage this AM makes me wonder whether they are truly ready for prime time. Biz phone service is mission critical.,2014-04-22 13:31:18,louisnyc,Chicago
537,457897245573005312,Just woke up to a power outage. Happy Easter? :/,2014-04-20 15:03:05,AngelJacoby,Chicago
538,457024397895692288,"based on census data, I'm one of 8 people without power pic.twitter.com/yUOO9zvWew",2014-04-18 05:14:42,paulish29,Chicago
539,456996008116101120,Watching in the lobby area of my apartment where the only TV is working with two random guys... #poweroutage #BecauseItsTheCup,2014-04-18 03:21:53,cthunberg23,Chicago
540,456979570114445312,well ComEd outage report says my power will be back in 15 min but no crew is working on it. How do this?!?,2014-04-18 02:16:34,paulish29,Chicago
541,456943989699411970,"awesome, @ComEd power outage just before Blackhawks game 1 puck drop. why?!?!",2014-04-17 23:55:11,paulish29,Chicago
542,456922392800272384,"The cops blocked off 79th and Narragansett, there was a power outage, and the ambulance are in my neighbor's house. Wtf is going on...",2014-04-17 22:29:22,fleetbender,Chicago
543,456575638682361856,Generator maintenance is crucial to ensure your generator is ready for the next power outage.,2014-04-16 23:31:29,PencoElectric,Chicago
544,456482416312336384,"@comcastcares My service is down but the lady on the phone says they are ""maximizing"" it. Outage is bad enough; her script is insulting.",2014-04-16 17:21:03,rjacoby,Chicago
545,455523969157054464,@comcast Internet outage in #southshore on the south side of #chicago,2014-04-14 01:52:32,EricAllixRogers,Chicago
546,455507847644594176,Things that don't work when the power's out: 1) baby monitor 2) white noise machine 3) lots of stuff I don't care about as much as 1 & 2,2014-04-14 00:48:28,MrsMinor813,Chicago
547,454453893179518976,The Whole Hood Had A Power Outage For Like An Hour.... That Was Just Mad Goofy,2014-04-11 03:00:26,Chuck_Inglish,Chicago
548,453006751852273664,Nothing like a power outage during Sunday show time to make an entire city block yell in unison. Thanks @ComEd! #neighborhoodbonding,2014-04-07 03:10:00,105KaySt,Chicago
549,452645868177719296,"Just lost power, had to run across the street to catch the rest of the game (@ McGinny's Tap) http://4sq.com/PyXZtH ",2014-04-06 03:15:59,rustbeltking,Chicago
550,451466105177903104,Steering my car was like a trip to the gym without power steering. #myworstcar,2014-04-02 21:08:01,TarahWalsh,Chicago
551,450257725864157184,@ComEd i think there is an outage in 60628,2014-03-30 13:06:21,KingTy773,Chicago
552,450039801786290177,"@RCNconnects is there a service outage? TBS is frozen/jumbled, it's not the free since I can stream it online pic.twitter.com/RjxFKFWs8V",2014-03-29 22:40:24,alphagopher,Chicago
553,449420553539973122,AND AGAIN !!! Power out nd these men keep howling smh,2014-03-28 05:39:44,Elchivito93,Chicago
554,449405662481502208,Yes yes people calm down we did loose power please stop howling like dogs #poweroutage pic.twitter.com/klsx1Rb6F1,2014-03-28 04:40:34,Elchivito93,Chicago
555,449290212120608768,Lost power at work this week. Lost power at school today. Sitting for 45 mins staring at a wall and counting,2014-03-27 21:01:48,DKConnected,Chicago
556,448645474505867264,@sauer_outage do not speak ill of Nate Silver.,2014-03-26 02:19:51,chloeotie,Chicago
557,447933352033529856,ComEd vault fire leaves people with out power: A Commonwealth Edison underground vault fire causes a power outage... http://dlvr.it/5Cz6TM ,2014-03-24 03:10:07,Chicago_CP,Chicago
558,447906461541076992,"@ComEd power out at Argyle and Leclaire, Chicago. But you probably knew that.",2014-03-24 01:23:16,adeitrich,Chicago
559,447858106169430016,"ComEd vault catches fire, at least 2 North Side buildings lose power: At least two buildings lost power Sunday... http://dlvr.it/5CvjJm ",2014-03-23 22:11:07,Chicago_CP,Chicago
560,447830657696161793,Power outage hits Near North Side: Part of the Near North Side was without power this afternoon after a minor... http://dlvr.it/5CtS57 ,2014-03-23 20:22:03,Chicago_CP,Chicago
561,447825056522326016,"Well, this sucks. 
#powerOutage #Chicagopic.twitter.com/2tWHBRVsqQ",2014-03-23 19:59:48,JayCeeEm,Chicago
562,447405528113631232,.@ComcastMike day 14 of Internet outage. Is there an update on when this will actually be fixed? Thank you. @comcastcares,2014-03-22 16:12:44,VictoriaGestner,Chicago
563,446836729329119232,Power is out on the block and I have to get ready for work ,2014-03-21 02:32:32,bgirlmystify,Chicago
564,446293906687152129,"I guess I'm the only one in Chicago that is feeling the @comcast ""major event"" outage?  How can this be? #comcastsucks @comcastcares ?",2014-03-19 14:35:33,paducah,Chicago
565,446282128980840448,"Wait, we lost power?!  Stuck on the redline between Jarvis and Morse. @cta",2014-03-19 13:48:45,dbora,Chicago
566,446133838511493120,"Hey #Comcast, what's with the outage here in Humboldt Park?",2014-03-19 03:59:30,EEgreenbunny,Chicago
567,446117629519208449,"@sayhi Hi guys, what's up with the outage. Not able to login. Hoping to start posting stories soon. Cheers!",2014-03-19 02:55:06,asifsyed,Chicago
568,446033881070723072,"@ComEd power is out rosemary ct countryside,il. Been going off and on all day.",2014-03-18 21:22:18,Scrummers13,Chicago
569,445962817988870144,@RCNconnects service outage in 60613?,2014-03-18 16:39:56,Sean_BevX,Chicago
570,445319520425897984,Sorry for the inconvenience we are having a power outage no electricity in our area,2014-03-16 22:03:41,Synergy1Radio,Chicago
571,445309884028829696,"@RCNconnects Is there internet outage in my area, or is it just me?",2014-03-16 21:25:24,rhrad,Chicago
572,445257809425600512,Words mean nothing without power,2014-03-16 17:58:28,Nino_BANDZ,Chicago
573,445071171667521536,Used the flashlight app for the first time ever tonight... So I could brush my teeth because of this power outage. #Technology,2014-03-16 05:36:51,jpwobs,Chicago
574,445063813046353920,Classic power outage on my block... #PeeingInTheDark,2014-03-16 05:07:36,jpwobs,Chicago
575,443979384114778112,Comcast internet outage again. Multiple times in 24hr period. Cool.,2014-03-13 05:18:28,polarizeme,Chicago
576,443855115498164225,Power out at Von Steuben today. I gotta say... It was pretty good pic.twitter.com/5qCvDomyXQ,2014-03-12 21:04:40,jacobpawletki,Chicago
577,443831118014328832,Heavy Snow Knocks Out Power to Tens of Thousands: Tens of thousands of people lost electricity when heavy snow... http://dlvr.it/57LH7d ,2014-03-12 19:29:19,Chicago_CP,Chicago
578,443771354525872130,This is the second power outage that I've been stuck in Halliday's class for,2014-03-12 15:31:50,ohhaiitsmorgan,Chicago
579,443748373825220608,"For the outage, Twitter replaced the whale with a caterpillar and an ice cream cone. What other avatars could be their replacements?",2014-03-12 14:00:31,andersonmj05,Chicago
580,443712440434302976,My power is out ,2014-03-12 11:37:44,ohhaiitsmorgan,Chicago
581,443619739588239360,@DaveScheidt Perfect. I wonder if @comcast DM'd @XFINITY about the outage. Phone keeps autocorrecting to outrage. Interesting.,2014-03-12 05:29:22,JeffSolin,Chicago
582,443614360586305536,@comcast outage in 60647 anyone?,2014-03-12 05:08:00,JeffSolin,Chicago
583,443362470271270912,"And 4th RCN Internet outage in two months. Now the fun task of finding a new provider, getting a new static IP address, switching. THANKS!",2014-03-11 12:27:04,MichelleLynneC,Chicago
584,442863864657371136,The @HBOGO outage is a liberal plot to make the American people watch that humanist filth @COSMOSonTV .,2014-03-10 03:25:48,MigsJimenez,Chicago
585,442833141686730752,Power is out again. Why is it always our side of the street?! WHY?!,2014-03-10 01:23:43,marles_barkly,Chicago
586,441832544623796225,"approx. 8:50pm I plugged my headphones into my laptop and over 2,000 people lost electricity for a half hour #truestory #powerout #Chicago",2014-03-07 07:07:42,TylerOmmen,Chicago
587,441818051877421056,Power is out in the entire building... Good thing I charged my phone ,2014-03-07 06:10:06,AshleeBerba,Chicago
588,441769257039179776,Power is out. Only source of light is scented candles… my food is going rotten but you'd never know through this 'Hawaiian Breeze'.,2014-03-07 02:56:13,stelyons,Chicago
589,441769084682641408,"Power outage on N. Kenmore Ave, & other areas around Irving Park / Sheridan. Turned off while I was editing. Damn. pic.twitter.com/buOkjIZ6fl",2014-03-07 02:55:32,rudyschieder,Chicago
590,441767445725208577,"No work to do tonight. Skipped all my chores to eat and binge watch Shameless. Come home, power's out.",2014-03-07 02:49:01,marysryu,Chicago
591,441766463712407552,"Power outage in Uptown. Help, @ComEd. My battery is dying, and the dark is scary.",2014-03-07 02:45:07,ohemilyjane,Chicago
592,441351447742283776,"Oh, you're good, @Amtrak. The interminable delays this winter weren't enough, so let's throw in a power outage. #Hiawatha #SittingInTheDark",2014-03-05 23:15:59,realbigbus,Chicago
593,440285155769712641,#AT&T 3G kayoed fubared all day around #Chitown; can't remember such a long outage in years. What's up @at@t? http://4sq.com/MGXBay ,2014-03-03 00:38:55,csrollyson,Chicago
594,440231012635648000,How in the hell my apt got a power outage at 3 in the afternoon of a sunday ,2014-03-02 21:03:47,CortEZingTon,Chicago
